{
  "schema_version": "0.1",
  "source_frame": {
    "robot_id": "research-unit-01",
    "sensor_id": "camera-mock-01",
    "sequence": 7
  },
  "detector": "fake",
  "image_width": 640,
  "image_height": 480,
  "processed_at": "2026-07-17T08:00:01Z",
  "detections": [
    {
      "detection_id": "det-0001",
      "class_id": 0,
      "class_name": "person",
      "confidence": 0.92,
      "bbox_xyxy": [10.0, 20.0, 110.0, 220.0],
      "observed_at": "2026-07-17T08:00:00Z"
    }
  ]
}
